{
  "schemaVersion": "1.0.0",
  "bibleVersion": "1.0.0",
  "chapterId": "05_BRAIN_STANDARD",
  "title": "Brain Standard",
  "status": "active",
  "authorityLevel": "architecture",
  "sourceReferences": [
    {
      "path": "scripts/dev-agent/core/BrainRegistry.js",
      "note": "Trusted worker definitions"
    },
    {
      "path": "scripts/dev-agent/core/MultiBrainPlanner.js",
      "note": "Brain planning orchestration"
    },
    {
      "path": "scripts/dev-agent/core/SafeCommandRunner.js",
      "note": "Bounded real command execution and evidence"
    },
    {
      "path": "scripts/dev-agent/core/EngineeringBrain.js",
      "note": "Isolated, new-file-only engineering artifact generation"
    },
    {
      "path": "scripts/dev-agent/core/EngineeringIntelligenceProvider.js",
      "note": "Replaceable proposal-only intelligence contract with no direct system authority"
    },
    {
      "path": "scripts/dev-agent/core/EngineeringProposalPolicy.js",
      "note": "Allow-listed structured proposal schema; raw provider code is rejected"
    },
    {
      "path": "scripts/dev-agent/core/ReviewerBrain.js",
      "note": "Independent artifact, patch, evidence, and governance verification"
    },
    {
      "path": "scripts/dev-agent/core/ArchitectBrain.js",
      "note": "Read-only structured goals, dependency plans, risks, and bounded Engineering handoffs"
    },
    {
      "path": "scripts/dev-agent/core/GovernedEngineeringLoop.js",
      "note": "Bounded Architect, Engineering, Tester, Reviewer correction loop"
    }
  ],
  "rules": [
    {
      "ruleId": "CH05_RULE_001",
      "statement": "Every brain must declare capabilities, allowed actions, and blocked actions.",
      "priority": "P0",
      "appliesTo": ["architect", "frontend", "backend", "engineering", "tester", "reviewer", "documentation"]
    },
    {
      "ruleId": "CH05_RULE_002",
      "statement": "All brains operate in approval-required mode for write-affecting outcomes.",
      "priority": "P0",
      "appliesTo": ["all"]
    },
    {
      "ruleId": "CH05_RULE_003",
      "statement": "Brain outputs must be reviewable and traceable in reports.",
      "priority": "P1",
      "appliesTo": ["reviewer", "documentation"]
    },
    {
      "ruleId": "CH05_RULE_004",
      "statement": "A brain may report execution success only when a real artifact or command result is supported by verifiable evidence.",
      "priority": "P0",
      "appliesTo": ["all"]
    },
    {
      "ruleId": "CH05_RULE_005",
      "statement": "Test execution requires explicit in-workspace targets, bounded timeouts, shell-disabled invocation, and captured exit evidence.",
      "priority": "P0",
      "appliesTo": ["tester"]
    },
    {
      "ruleId": "CH05_RULE_006",
      "statement": "Engineering intelligence providers may propose bounded artifacts but may not write source, execute commands, perform Git actions, or bypass isolated Tester Brain validation and Founder approval.",
      "priority": "P0",
      "appliesTo": ["engineering"]
    },
    {
      "ruleId": "CH05_RULE_007",
      "statement": "Reviewer Brain approval is a technical verdict only and never authorizes source application, commit, push, deploy, or replacement of Founder approval.",
      "priority": "P0",
      "appliesTo": ["reviewer"]
    },
    {
      "ruleId": "CH05_RULE_008",
      "statement": "Architect Brain plans are read-only and may hand off only allow-listed structured specifications; plans never authorize implementation or external action.",
      "priority": "P0",
      "appliesTo": ["architect"]
    },
    {
      "ruleId": "CH05_RULE_009",
      "statement": "Correction loops are attempt-bounded, stop immediately on Reviewer rejection, accept only allow-listed structured revisions, and never authorize source or Git actions.",
      "priority": "P0",
      "appliesTo": ["architect", "engineering", "tester", "reviewer"]
    }
  ]
}
